{
  "benchmark_id": "http-throughput-v1",
  "guarantee": {
    "formula": "candidate_median_rps >= baseline_median_rps * minimum_baseline_ratio",
    "minimum_baseline_ratio": 0.9,
    "passed": true,
    "threshold_rps": 97597.845
  },
  "methodology": {
    "build_optimize": "ReleaseFast",
    "contract_sha256": "d6de76594a2e7b587f016eed86a1f99fc19027eb19ad9a50cd2a15257e3cdb85",
    "execution_order": [
      "candidate",
      "baseline"
    ],
    "server_binary": "hello_world",
    "wrk": {
      "connections": 64,
      "duration_seconds": 10,
      "samples": 3,
      "statistic": "median",
      "target_url": "http://127.0.0.1:3000/",
      "threads": 2
    }
  },
  "provenance": {
    "baseline_flake_lock_sha256": "9f864be0e4329f6bfe6c5365922763633f08718411e083804b5c075bdefc74ad",
    "baseline_sha": "2eb3cd724a2b3e0167ae9fd2e2b50d7a5b072978",
    "candidate_flake_lock_sha256": "9f864be0e4329f6bfe6c5365922763633f08718411e083804b5c075bdefc74ad",
    "candidate_sha": "2eb3cd724a2b3e0167ae9fd2e2b50d7a5b072978",
    "event_name": "schedule",
    "git_ref": "refs/heads/main",
    "repository": "farbenbuilds/uWebZockets",
    "run_attempt": 1,
    "run_id": 36847853381,
    "workflow_run_url": "https://github.com/farbenbuilds/uWebZockets/actions/runs/36847853381"
  },
  "record_id": "36847853381-1-2eb3cd724a2b",
  "recorded_at": "2026-10-01T10:18:05Z",
  "results": {
    "baseline": {
      "median_rps": 108442.05,
      "samples_rps": [
        110270.37,
        108442.05,
        106611.65
      ]
    },
    "candidate": {
      "median_rps": 108779.88,
      "samples_rps": [
        96344.07,
        108779.88,
        114174.34
      ]
    },
    "candidate_to_baseline_ratio": 1.0031153044414045
  },
  "runner": {
    "architecture": "X64",
    "cpu_model": "AMD EPYC 9V74 80-Core Processor",
    "image": "ubuntu24/20260920.314.1",
    "kernel": "Linux 6.17.0-1022-azure #22-Ubuntu SMP Mon Jul 27 17:24:03 UTC 2026 x86_64 GNU/Linux",
    "name": "GitHub Actions 1000003294",
    "os": "Linux"
  },
  "schema_version": 1,
  "toolchain": {
    "nix_version": "nix (Nix) 2.35.2",
    "wrk_version": "unknown",
    "zig_version": "0.16.0"
  }
}
